method_id,label,kind,train_epochs,eval_episodes,success_count,success_rate,avg_len,delta_vs_positive
positive_only_nn_top40,Positive-only NN top40,baseline,200,20,17,0.850,148.2,0
weighted_bc_full_pool,Weighted BC full pool,baseline,200,20,13,0.650,211.5,-4
candidate_c_sequence_mask_e200,Candidate C sequence-mask e200,previous_candidate,200,20,16,0.800,167.7,-1
candidate_x_extra_negative_action_e200,Candidate X extra-only negative-action e200,previous_candidate,200,20,14,0.700,201.5,-3
sm_rwbc_m003_lam2_combined_e100,SM-RWBC m0.03 lambda2 combined e100,sota_candidate_1,100,20,10,0.500,260.0,-7
sm_rwbc_m003_lam2_combined_e200,SM-RWBC m0.03 lambda2 combined e200,sota_candidate_1,200,20,10,0.500,260.6,-7
