method_id,method_label,component_role,selection_rule,support_split_count,endpoint_split_count,selected_unlabeled,hidden_positive_selected,hidden_bad_selected,support_purity,hidden_positive_recall,hidden_bad_admission,delta_hidden_positive_vs_positive,delta_hidden_bad_vs_positive,endpoint_success,endpoint_success_count,split_successes,endpoint_delta_vs_positive_same_splits,endpoint_status,source,interpretation
positive_only_nn_top40,positive-only NN top40,positive-only anchor,nearest-neighbor retrieval from trusted positives,3,3,120,106,14,0.883,0.883,0.058,0,0,0.720,108/150,11:0.840;22:0.760;33:0.560,+0.000,complete_3split_endpoint,results/final_paper/tables/v02_union_candidate_support_summary.csv; results/final_paper/ablations/v02_union_endpoint_200ep_can40/endpoint_200ep_3split_summary.csv,"Strong high-precision baseline; the union must beat this, not just weighted BC."
positive_nn_risk_fusion_top40,risk-fusion top40,risk branch alone,rank fusion of positive similarity and action/bad-neighbor risk,3,2,120,117,3,0.975,0.975,0.013,11,-11,0.730,73/100,11:0.820;22:0.640,-0.070,partial_2split_endpoint,results/final_paper/tables/v02_union_candidate_support_summary.csv; results/final_paper/ablations/v02_union_endpoint_200ep_can40/split11; results/final_paper/ablations/v02_union_endpoint_200ep_can40/split22,"Improves hidden support labels, but loses the same two-split endpoint check to positive-only."
positive_nn_risk_union_top40,positive-NN/risk union top40,union candidate,positive-only support plus risk-fusion additions,3,3,135,119,16,0.881,0.992,0.067,13,2,0.773,116/150,11:0.760;22:0.780;33:0.780,+0.053,complete_3split_endpoint,results/final_paper/tables/v02_union_candidate_support_summary.csv; results/final_paper/ablations/v02_union_endpoint_200ep_can40/endpoint_200ep_3split_summary.csv,"Best pooled Can40 endpoint; the gain comes from added coverage on splits 22 and 33, not uniform dominance."
classifier_top40,classifier-only top40,classifier-only hard support,top-k by bad-aware classifier score,3,0,120,85,35,0.708,0.708,0.146,-21,21,,,,,support_only,results/final_paper/ablations/can40_score_support_tradeoff.csv,Support-only and dominated by positive-only top40 on both hidden-positive recovery and bad admission.
weighted_full_pool,weighted BC full pool,soft coverage baseline,sample all unlabeled demos with learned weights,3,3,360,120,240,0.333,1.000,1.000,14,226,0.600,90/150,11:0.720;22:0.440;33:0.640,-0.120,complete_3split_endpoint,results/final_paper/ablations/can40_score_support_tradeoff.csv,Full coverage admits all hidden bad support and trails the union endpoint.
triage_adaptive_masscap,v0.1 adaptive masscap,v0.1 hard support,original TRIAGE-BC support converter,3,3,190,110,80,0.579,0.917,0.333,4,66,0.660,99/150,11:0.760;22:0.520;33:0.700,-0.060,complete_3split_endpoint,results/final_paper/ablations/can40_score_support_tradeoff.csv,Beats weighted BC but admits too many bad demos relative to positive-only and the union.
